{
  "$schema": "https://json-schema.org/draft/2020-12/schema",
  "type": "object",
  "required": [
    "task_id",
    "invariants",
    "commands",
    "negative_tests",
    "required_artifacts"
  ],
  "properties": {
    "task_id": {
      "type": "string"
    },
    "invariants": {
      "type": "array",
      "items": {
        "type": "string"
      },
      "minItems": 1
    },
    "commands": {
      "type": "array",
      "items": {
        "type": "array",
        "items": {
          "type": "string"
        },
        "minItems": 1
      },
      "minItems": 1
    },
    "negative_tests": {
      "type": "array",
      "items": {
        "type": "string"
      }
    },
    "required_artifacts": {
      "type": "array",
      "items": {
        "type": "string"
      }
    }
  },
  "additionalProperties": false
}